{
  "$schema": "https://json-schema.org/draft/2020-12/schema",
  "$id": "verification-report.schema.json",
  "title": "Verification Report",
  "type": "object",
  "required": [
    "schema_version",
    "task_id",
    "commit",
    "status",
    "generated_at",
    "checks"
  ],
  "properties": {
    "schema_version": {
      "type": "string",
      "const": "1.0"
    },
    "task_id": {
      "type": "string"
    },
    "commit": {
      "type": "string"
    },
    "status": {
      "type": "string",
      "enum": [
        "PASSED",
        "FAILED"
      ]
    },
    "generated_at": {
      "type": "string"
    },
    "checks": {
      "type": "array",
      "items": {
        "type": "object",
        "required": [
          "name",
          "status",
          "required",
          "command",
          "notes"
        ],
        "properties": {
          "name": {
            "type": "string"
          },
          "status": {
            "type": "string",
            "enum": [
              "PASSED",
              "FAILED",
              "SKIPPED"
            ]
          },
          "required": {
            "type": "boolean"
          },
          "command": {
            "type": "array",
            "items": {
              "type": "string"
            }
          },
          "notes": {
            "type": "string"
          }
        },
        "additionalProperties": false
      }
    }
  },
  "additionalProperties": false
}
