{
  "schema_version": "1.0",
  "task_id": "FOUNDATION-001",
  "commit": "b0a4d53ecdb1e0489f8cf52d2c0ebeecf72b62bb",
  "status": "PASSED",
  "generated_at": "2026-08-15T04:21:05.987790+00:00",
  "checks": [
    {
      "name": "project-schema",
      "status": "PASSED",
      "required": true,
      "command": [
        "/mnt/c/Users/jeeva/Desktop/VeriClaim/.venv/bin/python",
        "scripts/validate-project.py"
      ],
      "notes": ""
    },
    {
      "name": "task-schema-and-reports",
      "status": "PASSED",
      "required": true,
      "command": [
        "/mnt/c/Users/jeeva/Desktop/VeriClaim/.venv/bin/python",
        "scripts/validate-task.py",
        "FOUNDATION-001"
      ],
      "notes": ""
    },
    {
      "name": "openapi-contract",
      "status": "PASSED",
      "required": true,
      "command": [
        "/mnt/c/Users/jeeva/Desktop/VeriClaim/.venv/bin/python",
        "scripts/validate-contracts.py"
      ],
      "notes": ""
    },
    {
      "name": "agentic-framework-tests",
      "status": "PASSED",
      "required": true,
      "command": [
        "/mnt/c/Users/jeeva/Desktop/VeriClaim/.venv/bin/python",
        "-m",
        "pytest",
        "-q",
        "tests/agentic"
      ],
      "notes": ""
    },
    {
      "name": "tracked-secret-file-baseline",
      "status": "PASSED",
      "required": true,
      "command": [
        "git",
        "ls-files"
      ],
      "notes": ""
    }
  ]
}
